{
  "schema_version": "0.3.0",
  "document_type": "load_schedule",
  "generated_at": "2026-08-07T00:00:00Z",
  "registry_id": "homestead.primary.v0_3",
  "site_id": "site.site.primary.01",
  "source_refs": [
    {
      "document": "Homestead_Digital_Twin_Software_Design_Document_v0.3.md",
      "section": "31.1, 31.2, 32.2, 33.3, 49 item 1"
    }
  ],
  "tier_model": {
    "0": "Physical protection and control survival. Normally not shed by the EMS (SDD 31.2).",
    "1": "Essential service. Shed only under emergency plans with defined survival behaviour.",
    "2": "Important operations. May be reduced, duty-cycled or temporarily shed.",
    "3": "Deferrable operations. Normally shed in CONSERVE or earlier if forecast margin is poor.",
    "4": "Opportunistic surplus operations. Enabled only under a granted surplus budget."
  },
  "shed_groups": [
    {
      "group": "S1",
      "order": 1,
      "action": "Stop opportunistic surplus loads"
    },
    {
      "group": "S2",
      "order": 2,
      "action": "Defer new deferrable work"
    },
    {
      "group": "S3",
      "order": 3,
      "action": "Reduce active deferrable loads"
    },
    {
      "group": "S4",
      "order": 4,
      "action": "Enter subsystem conservation profiles"
    },
    {
      "group": "S5",
      "order": 5,
      "action": "Shed nonessential Tier 2 branches"
    },
    {
      "group": "S6",
      "order": 6,
      "action": "Enter critical survival profiles"
    },
    {
      "group": "S7",
      "order": 7,
      "action": "Controlled IT shutdown"
    },
    {
      "group": "S8",
      "order": 8,
      "action": "Emergency isolation through defined emergency procedure and equipment-native controls only"
    }
  ],
  "restoration_groups": [
    {
      "group": "R1",
      "order": 1,
      "action": "Core controls, communications, refrigeration, freeze protection"
    },
    {
      "group": "R2",
      "order": 2,
      "action": "Water and greenhouse normal-minimum operation"
    },
    {
      "group": "R3",
      "order": 3,
      "action": "Normal rack services and routine building systems"
    },
    {
      "group": "R4",
      "order": 4,
      "action": "Deferred pumping, treatment and equipment charging"
    },
    {
      "group": "R5",
      "order": 5,
      "action": "Batch compute and opportunistic loads"
    }
  ],
  "loads": [
    {
      "asset_id": "energy.load.site.control_core_01",
      "name": "Critical Control and Communications Core",
      "base_tier": 0,
      "criticality": "critical",
      "rated_power_kw": null,
      "estimated_power_kw": 0.25,
      "measured_power_point": "energy.load.site.control_core_01/power_kw",
      "control_method": "automatic_supervisory",
      "branch_circuit": null,
      "panel_asset_id": "energy.panel.power_container.critical_01",
      "minimum_service": {
        "mode": "continuous",
        "maximum_off_time_min": 0
      },
      "restart": {
        "delay_s": 0,
        "inrush_class": "none",
        "minimum_off_time_s": 0,
        "automatic_restart_permitted": true
      },
      "shed": {
        "permitted": false,
        "local_survival_mode": false,
        "notification_required": true,
        "action": "never_shed"
      },
      "shed_group": null,
      "shed_order": null,
      "restoration_group": "R1",
      "restoration_order": 10,
      "minimum_on_time_s": null,
      "minimum_off_time_s": null,
      "data_status": "estimated",
      "open_fields": [
        "branch_circuit",
        "rated_power_kw",
        "measured_idle_power_kw",
        "measured_peak_power_kw",
        "control_interface",
        "restart_delay_s",
        "inrush_class",
        "minimum_on_time_s",
        "minimum_off_time_s"
      ],
      "notes": [
        "SDD 31.2 Tier 0: emergency-stop circuits, control-panel power, secondary control node, core timing and minimum communications. Never shed by the EMS.",
        "estimated_power_kw carries the register planning_baseline_kw, not a measurement."
      ]
    },
    {
      "asset_id": "energy.load.site.server_rack_01",
      "name": "Primary Server Rack",
      "base_tier": 1,
      "criticality": "critical",
      "rated_power_kw": null,
      "estimated_power_kw": 1.5,
      "measured_power_point": "energy.load.site.server_rack_01/power_kw",
      "control_method": "automatic_supervisory",
      "branch_circuit": null,
      "panel_asset_id": "energy.panel.power_container.critical_01",
      "minimum_service": {
        "mode": "core_services_only",
        "maximum_off_time_min": null
      },
      "restart": {
        "delay_s": 120,
        "inrush_class": "medium",
        "minimum_off_time_s": 300,
        "automatic_restart_permitted": true
      },
      "shed": {
        "permitted": true,
        "local_survival_mode": true,
        "notification_required": true,
        "action": "graceful_shutdown"
      },
      "shed_group": "S7",
      "shed_order": 10,
      "restoration_group": "R3",
      "restoration_order": 10,
      "minimum_on_time_s": 600,
      "minimum_off_time_s": 300,
      "data_status": "estimated",
      "open_fields": [
        "branch_circuit",
        "rated_power_kw",
        "measured_idle_power_kw",
        "measured_peak_power_kw",
        "control_interface",
        "restart_delay_s",
        "inrush_class",
        "minimum_on_time_s",
        "minimum_off_time_s",
        "ups_graceful_shutdown_budget_min"
      ],
      "notes": [
        "SDD 31.2 Tier 1 core networking, DNS, MQTT and digital-twin services; SDD 31.3 splits server workloads so batch compute is carried by energy.load.site.opportunistic_compute_01.",
        "SDD 32.2 group S7 is a controlled IT shutdown executed by the IT orchestration service (SDD 30.4); the EMS publishes state and deadline, it does not cut rack power.",
        "estimated_power_kw carries the register planning_baseline_kw, not a measurement."
      ]
    },
    {
      "asset_id": "energy.load.site.rack_cooling_01",
      "name": "Rack Cooling",
      "base_tier": 0,
      "criticality": "critical",
      "rated_power_kw": null,
      "estimated_power_kw": null,
      "measured_power_point": "energy.load.site.rack_cooling_01/power_kw",
      "control_method": "automatic_supervisory",
      "branch_circuit": null,
      "panel_asset_id": "energy.panel.power_container.critical_01",
      "minimum_service": {
        "mode": "minimum_container_cooling",
        "maximum_off_time_min": null
      },
      "restart": {
        "delay_s": 60,
        "inrush_class": "high",
        "minimum_off_time_s": 300,
        "automatic_restart_permitted": true
      },
      "shed": {
        "permitted": false,
        "local_survival_mode": true,
        "notification_required": true,
        "action": "never_shed"
      },
      "shed_group": null,
      "shed_order": null,
      "restoration_group": "R1",
      "restoration_order": 30,
      "minimum_on_time_s": null,
      "minimum_off_time_s": 300,
      "data_status": "unknown",
      "open_fields": [
        "branch_circuit",
        "rated_power_kw",
        "measured_idle_power_kw",
        "measured_peak_power_kw",
        "control_interface",
        "restart_delay_s",
        "inrush_class",
        "minimum_on_time_s",
        "minimum_off_time_s",
        "maximum_off_time_min",
        "minimum_cooling_profile_kw"
      ],
      "notes": [
        "SDD 31.2 Tier 0 minimum battery/container environmental protection.",
        "SDD 31.2 Tier 2 also lists normal rack cooling above the minimum critical-compute profile; that reduction is a local-controller setpoint change, not an EMS shed."
      ]
    },
    {
      "asset_id": "energy.load.site.battery_hvac_01",
      "name": "Battery-Zone HVAC",
      "base_tier": 0,
      "criticality": "critical",
      "rated_power_kw": null,
      "estimated_power_kw": null,
      "measured_power_point": "energy.load.site.battery_hvac_01/power_kw",
      "control_method": "automatic_supervisory",
      "branch_circuit": null,
      "panel_asset_id": "energy.panel.power_container.critical_01",
      "minimum_service": {
        "mode": "battery_temperature_governed",
        "maximum_off_time_min": null
      },
      "restart": {
        "delay_s": 60,
        "inrush_class": "high",
        "minimum_off_time_s": 300,
        "automatic_restart_permitted": true
      },
      "shed": {
        "permitted": false,
        "local_survival_mode": true,
        "notification_required": true,
        "action": "never_shed"
      },
      "shed_group": null,
      "shed_order": null,
      "restoration_group": "R1",
      "restoration_order": 20,
      "minimum_on_time_s": null,
      "minimum_off_time_s": 300,
      "data_status": "unknown",
      "open_fields": [
        "branch_circuit",
        "rated_power_kw",
        "measured_idle_power_kw",
        "measured_peak_power_kw",
        "control_interface",
        "restart_delay_s",
        "inrush_class",
        "minimum_on_time_s",
        "minimum_off_time_s",
        "maximum_off_time_min",
        "minimum_cooling_profile_kw"
      ],
      "notes": [
        "SDD 31.2 Tier 0 minimum battery environmental protection. Shedding battery cooling to save reserve would defeat SDD 30.3 objective 1."
      ]
    },
    {
      "asset_id": "energy.load.site.water_pumping_01",
      "name": "Well and Essential Water Pumping",
      "base_tier": 1,
      "criticality": "critical",
      "rated_power_kw": null,
      "estimated_power_kw": null,
      "measured_power_point": "energy.load.site.water_pumping_01/power_kw",
      "control_method": "automatic_supervisory",
      "branch_circuit": null,
      "panel_asset_id": "energy.panel.power_container.critical_01",
      "minimum_service": {
        "mode": "potable_water_minimum",
        "maximum_off_time_min": null
      },
      "restart": {
        "delay_s": 60,
        "inrush_class": "high",
        "minimum_off_time_s": 300,